[
    {
        "username": "sspl-ll",
        "description": "Seagate Storage Platform Library - Low Level - Sensor Response",
        "title": "SSPL-LL Sensor Response",
        "expires": 3600,
        "signature": "None",
        "time": "2019-11-18 16:48:30.055424",
        "message": {
          "sspl_ll_msg_header": {
            "msg_version": "1.0.0",
            "schema_version": "1.0.0",
            "sspl_version": "1.0.0"
          },
          "sensor_response_type": {
            "info": {
              "event_time": "1574075909",
              "resource_id": "Fan Module 4",
              "site_id": 1,
              "node_id": 1,
              "cluster_id": 1,
              "rack_id": 1,
              "resource_type": "enclosure:fru:fan"
            },
            "alert_type": "missing",
            "severity": "critical",
            "specific_info": {
              "status": "Not Installed",
              "name": "Fan Module 4",
              "enclosure-id": 0,
              "durable-id": "fan_module_0.4",
              "fans": [],
              "health-reason": "The fan module is not installed.",
              "health": "Fault",
              "location": "Enclosure 0 - Right",
              "position": "Indexed",
              "health-recommendation": "Install the missing fan module."
            },
            "alert_id": "15740759091a4e14bca51d46908ac3e9102605d560",
            "host_id": "s3node-host-1"
          }
        }
      },
      {
        "username": "sspl-ll",
        "description": "Seagate Storage Platform Library - Low Level - Sensor Response",
        "title": "SSPL-LL Sensor Response",
        "expires": 3600,
        "signature": "None",
        "time": "2019-11-18 16:48:30.055000",
        "message": {
          "sspl_ll_msg_header": {
            "msg_version": "1.0.0",
            "schema_version": "1.0.0",
            "sspl_version": "1.0.0"
          },
          "sensor_response_type": {
            "info": {
              "event_time": "1574075909",
              "resource_id": "Fan Module 4",
              "site_id": 1,
              "node_id": 1,
              "cluster_id": 1,
              "rack_id": 1,
              "resource_type": "enclosure:fru:fan"
            },
            "alert_type": "missing",
            "severity": "critical",
            "specific_info": {
              "status": "Not Installed",
              "name": "Fan Module 4",
              "enclosure-id": 0,
              "durable-id": "fan_module_0.4",
              "fans": [],
              "health-reason": "The fan module is not installed.",
              "health": "Fault",
              "location": "Enclosure 0 - Right",
              "position": "Indexed",
              "health-recommendation": "Install the missing fan module."
            },
            "alert_id": "15740759091a4e14bca51d46908ac3e9102605d000",
            "host_id": "s3node-host-1"
          }
        }
      }
]