{
 "username": "sspl-ll",
 "expires": 3600,
 "description": "Seagate Storage Platform Library - Low Level - Actuator Request",
 "title": "SSPL-LL Actuator Request",
 "signature": "None",
 "time": "",
 "message": {
   "sspl_ll_debug": {
     "debug_component": "sensor",
     "debug_enabled": true
   },
   "sspl_ll_msg_header": {
     "msg_version": "1.0.0",
     "uuid": "",
     "schema_version": "1.0.0",
     "sspl_version": "1.0.0"
   },
   "actuator_request_type": {
     "node_controller": {
       "node_request": "NDHW:",
       "resource": "*"
     }
   }
 }
}
